title,body,score,comments,created,cleaned_title,cleaned_body
Conversation I had with my ex this morning.,,38622,1063,1663954089.0,conversation ex morning,
UNITED STONKS OF AMERICA.,,38558,806,1611848204.0,united stonks america,
Went all in this morning! Support From France ☀️🇫🇷,,38555,1055,1612180068.0,went morning support france,
You are all being ridiculous with these endless posts,"All these “I made $368 on my BIG DICK YOLO PLAY praise my nuts and MOONY MOONY HOLDLD” bullshit is fucking ridiculous! 

Having been here since before GameStop in January ( not by much), all of a sudden this sub is all about teamwork and taking down the corporate elite and “please we need help for stock XYZ!!!” or “ignore ABC!! You fools!! It’s all about 123!!!” All from accounts that are made in the last three to four months.

For fucks sake, this is not a team effort. This is not a bunch of masked individuals here to help you get out of the hole you dug by betting your rent money or your fucking aunt may’s entire pocket book on stocks that rise and fall by the swing of your dick! We are all here to make money and I wish everyone could remember WSB in its prime where you only posted actual shitpost memes from gladiator or some high quality material once in awhile to break up the real and massive loss/gain/yolo porn. That made it a little better when sifting through the scum of posts with ass DD to find that diamond in the rough of someone who posted something NEW or actually added info instead of repeating the same echo chamber of a false hope that “___ is the next BIG SQUEEEEZE” 

How about you gamma squeeze these nuts, shut the fuck up, and read instead of posting more bullshit for the mods to wipe clean like a triple-ply once-over clandestine shit sweep. These mods are heroes for listening to this cringy begging ape shit for months now, so try to make their lives easier and learn something in the process. 

Today was a bloodbath for memes, so welcome to fucking Valhalla you shit for brains monkeys, the keys to get out are on the next play if you managed not to lose it all or have another aunt to short squeeze. 

End rant 

Sorry for probably breaking the rules mods, you guys rock.

EDIT: first off, thanks for the awards and support blah blah blah I knew you guys were still hanging around like me, wading through the seas of bullshit posts to find my own bullshit post! But I’ve let you down, I forgot the first rule I ever learned here, which I learned before GME, before the “thanks u/CumFlakess”, before the Purple Mattress King, or low battery, etc..

POSITIONS OR BAN!!! 

Positions: 
1000 shares of SNDL
45 shares of CLOV and $12c 7/16 x4 
100 shares of WISH
350 shares of UWMC and 16c + 14c 7/16 x15
And a bunch of Wendy’s puts because even I saw that one coming",38541,4784,1623253801.0,ridiculous endless posts,made big dick yolo play praise nuts moony moony holdld bullshit fucking ridiculous since gamestop january much sudden sub teamwork taking corporate elite please need help stock xyz ignore abc fools accounts made last three four months fucks sake team effort bunch masked individuals help get hole dug betting rent money fucking aunt mays entire pocket book stocks rise fall swing dick make money wish everyone could remember wsb prime posted actual shitpost memes gladiator high quality material awhile break real massive lossgainyolo porn made little better sifting scum posts ass dd find diamond rough someone posted something new actually added info instead repeating echo chamber false hope next big squeeeeze gamma squeeze nuts shut fuck read instead posting bullshit mods wipe clean like tripleply onceover clandestine shit sweep mods heroes listening cringy begging ape shit months try make lives easier learn something process today bloodbath memes welcome fucking valhalla shit brains monkeys keys get next play managed lose another aunt short squeeze end rant sorry probably breaking rules mods guys rock edit first thanks awards support blah blah blah knew guys still hanging around like wading seas bullshit posts find bullshit post ive let forgot first rule ever learned learned gme thanks ucumflakess purple mattress king low battery etc positions ban positions shares sndl shares clov c x shares wish shares uwmc c c x bunch wendys puts even saw one coming
"$181,840 gain in 4 hours from $RKT. Time to give my wife that wedding she always wanted.",,38515,2486,1614713358.0,gain hours rkt time give wife wedding always wanted,
New WSB members after making their first profitable play:,,38477,526,1614104028.0,new wsb members making first profitable play,
"$10k ----> $364,000 4 trades in 3 days",,38468,2496,1622129836.0,k trades days,
Elon Musk and the SEC in a nutshell,,38429,708,1538142376.0,elon musk sec nutshell,
"The squozening shall squazozzle later than you hope, sooner than you fear, and right when you least expect it. 💎✊",,38423,1475,1614134317.0,squozening shall squazozzle later hope sooner fear right least expect,
$950K Buy order waiting to get filled!,,38361,1300,1612369033.0,k buy order waiting get filled,
CNBC is trying so Hard. LMAO 😂,,38329,1853,1615361958.0,cnbc trying hard lmao,
"WELCOME TO WALLSTREETBETS, SOLDIERS!",,38287,850,1607608367.0,welcome wallstreetbets soldiers,
Let’s not forget the day President Kennedy spoke to our forefathers,,38260,669,1639622843.0,lets forget day president kennedy spoke forefathers,
Robinhood CEO expected to testify before U.S. House committee on February 18,,38244,1877,1612215530.0,robinhood ceo expected testify us house committee february,
This week..!,,38231,461,1651971298.0,week,
Twitter's next board meeting,,38220,365,1649168848.0,twitters next board meeting,
Robinhood looking to hire government affairs staffers to navigate their impending congressional hearings,,38216,807,1611934323.0,robinhood looking hire government affairs staffers navigate impending congressional hearings,
My WSB experience so far,,38187,423,1626372911.0,wsb experience far,
JUST YOLO'D 330K TO HELP KEEP THIS PARTY GOING TO THE MOON,,38163,752,1611944747.0,yolod k help keep party going moon,
"You degenerates made The Economist print, ""Daddy Musk.""",,38156,724,1613520526.0,degenerates made economist print daddy musk,
Me after taking wsb advice,,38139,326,1642338102.0,taking wsb advice,
Guh,,38106,754,1625272907.0,guh,
One of us ,,38064,1087,1708685473.0,one us,
Repost for exposure. OP: u/DNXPeeJay,,38069,636,1611849379.0,repost exposure op udnxpeejay,
🥲,,37919,292,1679372333.0,,
GME YOLO/FOMO my second mortgage. 35k to 5mil to 300k. I WILL NOT SELL!,,37895,3765,1612473375.0,gme yolofomo second mortgage k mil k sell,
2023 Gonna Start Off Right,,37866,714,1671956023.0,gon na start right,
"2 years ago, I Yolo’d my entire life savings into an Australian mining penny stock (no longer considered a penny stock by WSB rules). Started with $100k initial investment at 8c levels and have been averaging up each month ever since. This has been life changing. No one in my personal life knows",,37860,2991,1631564717.0,years ago yolod entire life savings australian mining penny stock longer considered penny stock wsb rules started k initial investment c levels averaging month ever since life changing one personal life knows,
Surprise mf,,37764,699,1615835159.0,surprise mf,
People are risking their lives to wage war against the suits and it brings tears to my eyes to watch them do it.,"That is not hyperbole. Money isn't just paper used to buy cocaine and hookers. It is a physical representation of a portion of a man's life. Make $50,000 a year in a soul sucking desk job? Taking a $50,000 position on $GME is risking a year off your life to fight this good fight. The amount of years so many of you are willing to put on the line is an amazing testament to how dedicated this sub is to fucking these bastards raw. The bastards who steal thousands of years off the regular man's lives every single day. You're fighting the good fight, and your sacrifices will not be forgotten.  💎🙌🏻🚀🌕 ",37714,1464,1611903383.0,people risking lives wage war suits brings tears eyes watch,hyperbole money isnt paper used buy cocaine hookers physical representation portion mans life make year soul sucking desk job taking position gme risking year life fight good fight amount years many willing put line amazing testament dedicated sub fucking bastards raw bastards steal thousands years regular mans lives every single day youre fighting good fight sacrifices forgotten
AMC TO PLUTO 🚀🚀🚀,,37691,1120,1612147024.0,amc pluto,
How do I short Cadillac?,,37663,2116,1665430256.0,short cadillac,
AOC calling out Robinhood,,37598,513,1611852706.0,aoc calling robinhood,
Upvote to ban all of Canada from the internet,"Pls

http://www.marketwatch.com/story/this-trader-bets-it-all-on-apple-getting-crushed-after-earnings-2017-01-30

http://i.imgur.com/9hWYLOv.jpg

https://gfycat.com/SizzlingLivelyHarborporpoise

When Canadian autism hits critical mass.
https://youtu.be/OgZUvESyxbU?t=39s


TLDR:  #CanaBan2017",37582,1156,1485899370.0,upvote ban canada internet,pls httpwwwmarketwatchcomstorythistraderbetsitallonapplegettingcrushedafterearnings httpiimgurcomhwylovjpg httpsgfycatcomsizzlinglivelyharborporpoise canadian autism hits critical mass httpsyoutubeogzuvesyxbuts tldr canaban
My losses today don’t compare to these losses. I require a sacrifice from u/LifeLiterature0987,,37572,1361,1612218891.0,losses today dont compare losses require sacrifice ulifeliterature,
highly regarded,,37545,474,1661083174.0,highly regarded,
AirBnB NASDAQ Debut,,37534,929,1607652246.0,airbnb nasdaq debut,
Nice!,,37500,765,1650324946.0,nice,
AMC’s Four-Day Surge Slaps Short Sellers With $1.3 Billion Loss,,37498,2212,1622157219.0,amcs fourday surge slaps short sellers billion loss,
"For the first time in my life... I feel.. At home 😌 $-148,173.58",,37484,1838,1587658794.0,first time life feel home,
So it begins..,,37437,2041,1616995640.0,begins,
Once upon a time..,,37433,888,1622712116.0,upon time,
GME Shareholders Today,,37435,699,1611968417.0,gme shareholders today,
Tesla up 1% today after announcing a $5 billion offering,,37407,1219,1607459101.0,tesla today announcing billion offering,
Everyone Trading the TSLA Squeeze Today,,37375,991,1594692102.0,everyone trading tsla squeeze today,
Even CNBC is now reporting that Melvin and Vlad are in cahoots,,37363,1860,1614264444.0,even cnbc reporting melvin vlad cahoots,
I have analyzed GME prices in relation to Moon phases,,37336,1203,1614947005.0,analyzed gme prices relation moon phases,
GameStop Q4 Earnings Megathread 🍿,"🍿 Post to be updated with links to the earnings report as soon as they're released. 🍿

#🙏🥑🙏🥑🙏🥑🙏🥑🙏🥑🙏🥑🙏🥑🙏🥑🙏🥑

[Earnings Call Webcast](https://viavid.webcasts.com/starthere.jsp?ei=1424794&tp_key=d5ec83cadf) ~~<--- ENTER BEFORE IT FILLS UP~~ - STARTS AT 5PM EST

~~[Earnings Call is FULL, use this link for a backup stream](https://www.youtube.com/watch?v=cvh0nX08nRw)~~ Backup link is full

#[EARNINGS REPORT](https://investor.gamestop.com/news-releases/news-release-details/gamestop-reports-fourth-quarter-and-fiscal-2020-results)",37322,31850,1616524215.0,gamestop q earnings megathread,post updated links earnings report soon theyre released earnings call webcasthttpsviavidwebcastscomstartherejspeitpkeydeccadf enter fills starts pm est earnings call full use link backup streamhttpswwwyoutubecomwatchvcvhnxnrw backup link full earnings reporthttpsinvestorgamestopcomnewsreleasesnewsreleasedetailsgamestopreportsfourthquarterandfiscalresults
"WALL STREET PLAN - Trying to psychologically scare you with MANIPULATED BIG DIPS and then a SMALL recovery. They want to MAKE YOU DOUBT, that the NEXT BIG DIP, you could’ve SOLD at Recovery. This has been going on since Thursday for GME & AMC","Everyone,

TIME is the enemy of Wall Street. They’re running like a chicken with no head. They have to COVER and pay INTEREST!!

AS LONG AS YOU HOLD AND DONT SELL, those big dips are NOT REALIZED LOSSES! They’re just psychological losses to make you DOUBT AND SELL!

Brokers restricting PURCHASE of these stocks is creating an UNFAIR ratio of SUPPLY and due to the restriction of stock it creates a LOW DEMAND! Therefore when there’s a big supply and low demand is when the stock price goes down. However, there is A LOT OF DEMAND and that’s why they’re playing DIRTY and restricted purchase to CREATE A FAKE LOW DEMAND! That’s why there are lawsuits. 

1) HOLD AND BUY THE DIPS

2) DONT LET WALL STREET BULLY YOU

3) AS DAY PASSES WALL STREET CONTINUE TO BLEED since they have to cover and pay interest

4)HOLD AND BUY🚀🚀🚀🚀🚀🌕

5)REMOVE YOUR STOP LOSSES❗️❗️❗️❗️❗️

6) SET LIMIT AS HIGH AS YIU CAN

7) DO NOT LOCK IN GAINS because you want to BUY DIPS. With the restriction, this strategy is not plausible

8) AMC/GME ruled out bankruptcy so your stock won’t be $0

9) DOUBLE CHECK any news or analyst or posts as they may try to scare you with fake facts. Do your own DD

10) think positive of the BIG REWARD. You CANT lose more than your total investment but  GAINS ARE LIMITLESS and this is what’s SCARING wallstreet. (Example if you invested 10k, all you would lose would be 10k but could be walking away with 100k, 1 million , 10 million depending on the resilience of all of us to BUY AND HOLD🚀🚀🚀🚀🚀🚀🚀🚀🌕)

11) Check (barstool el presidente) David Portnoy’s videos where he simplified and explains the illegal shit wallstreet is doing. Gotta love this man",37265,1415,1612196190.0,wall street plan trying psychologically scare manipulated big dips small recovery want make doubt next big dip couldve sold recovery going since thursday gme amc,everyone time enemy wall street theyre running like chicken head cover pay interest long hold dont sell big dips realized losses theyre psychological losses make doubt sell brokers restricting purchase stocks creating unfair ratio supply due restriction stock creates low demand therefore theres big supply low demand stock price goes however lot demand thats theyre playing dirty restricted purchase create fake low demand thats lawsuits hold buy dips dont let wall street bully day passes wall street continue bleed since cover pay interest hold buy remove stop losses set limit high yiu lock gains want buy dips restriction strategy plausible amcgme ruled bankruptcy stock wont double check news analyst posts may try scare fake facts dd think positive big reward cant lose total investment gains limitless whats scaring wallstreet example invested k would lose would k could walking away k million million depending resilience us buy hold check barstool el presidente david portnoys videos simplified explains illegal shit wallstreet got ta love man
Remember the internet bubble? Here’s me selling 1000 shares of AMZN at $6.,,37225,2012,1631384312.0,remember internet bubble heres selling shares amzn,
Pay $70k a year to study Securities regulation at law school just to read about you reetards,,37184,1199,1648314642.0,pay k year study securities regulation law school read reetards,
"Welcome back, zjz.","Earlier today, Reddit Admins gave us the green light to bring back u/zjz to the mod team. It's hard to overstate how fantastic a development this is. 

Since the most recent mod shakeup, the entire team has been petitioning to bring zjz back. We wanted to keep you in the loop, but couldn't, because it might have hurt our chances of getting zjz back. We understand why this might have made you suspicious, but we're excited to put those suspicions to rest today.

Reddit Admins care deeply about the stability and continuity of the community, and so do we. At the end of the day, WSB is not defined by who is at the top of the mod list, it's defined by the conversations we create.

Even in the absence of zjz, we saw awesome discussions happening. Tons of great DDs, insane YOLOs, and beautiful, beautiful, gain and loss porn.

Now, with zjz back, we can take things even further. We can relax posting restrictions on account age and karma, which we use as proxies for post quality, and instead focus on the content of what's being said.

The truth is, I am very, very, optimistic about the future of WSB over the next 3-5 years. We have the absolute best mod team the subreddit has had since inception. Everyone who is part of a team now is someone that has played a big role of either the subreddit, or discord, community for years.

We appreciate your patience with us and the admins. We were all blindsided as we were thrown into this shakeup. No doubt mistakes were made at the beginning, but we're getting better every day to bring you the WSB you probably don't deserve.

Edit: [proof or ban](https://i.imgur.com/JXneIJ0.png)",37154,2680,1613517868.0,welcome back zjz,earlier today reddit admins gave us green light bring back uzjz mod team hard overstate fantastic development since recent mod shakeup entire team petitioning bring zjz back wanted keep loop couldnt might hurt chances getting zjz back understand might made suspicious excited put suspicions rest today reddit admins care deeply stability continuity community end day wsb defined top mod list defined conversations create even absence zjz saw awesome discussions happening tons great dds insane yolos beautiful beautiful gain loss porn zjz back take things even relax posting restrictions account age karma use proxies post quality instead focus content whats said truth optimistic future wsb next years absolute best mod team subreddit since inception everyone part team someone played big role either subreddit discord community years appreciate patience us admins blindsided thrown shakeup doubt mistakes made beginning getting better every day bring wsb probably dont deserve edit proof banhttpsiimgurcomjxneijpng
Russian Mafia in Shambles as Adidas closes Stores in Russia,,37129,690,1646800422.0,russian mafia shambles adidas closes stores russia,
Never stop,,37124,392,1654526980.0,never stop,
Discord Chat For Billionaires [part 1],,37063,750,1644253827.0,discord chat billionaires part,
My dentist said I grind in my sleep. He real af for that 😤,,37068,329,1679818018.0,dentist said grind sleep real af,
Its the way it goes,,37055,433,1636039824.0,way goes,
bearish on $TSLA,,36999,4455,1657179865.0,bearish tsla,
"RH has to shut down trading due to cash, but they got enough for Super Bowl ads",,36971,1003,1612357909.0,rh shut trading due cash got enough super bowl ads,
Elon Musk confirms that Bill Gates has a 500 million short position against Tesla,,36933,6321,1650686989.0,elon musk confirms bill gates million short position tesla,
Goodnight Mama Su 🌃,,36832,428,1536800153.0,goodnight mama su,
"SEC, DOJ, 60 Minutes – Public data suggests massive securities fraud in which hedge funds and institutions have created more Gamestop shares than actually exist for delivery","Obligatory emoji 🚀

**Short Version:**
The short version is that a review of the **'strategic fails–to–deliver'** data indicates that institutional insiders may have counterfeited a massive number of Gamestop shares which is why they tried to stop retail investors from buying more shares on Thursday.

There are are **71 million shares** of GME that have ever been issued by the company. Institutions have reported to the SEC via 13F filings that they own more than **102,000,000** shares (including the 13% of GME stock is owned by Ryan Cohen).  That is already 30,000,000 shares more than even exist.

On top of the shares reportedly owned by institutions, retail investors may currently hold 50+ million shares (counting both  long holdings and call options – both ITM and OTM).  

Once you include call options, **retail investors may already hold more than 100% of GME (not just 100% of the float, more than 100% of the actual company)**. This would be definitive proof of illegal activity at the highest levels of the financial system.


**Long Version:**
A more detailed analysis by /u/johnnydaggers is here. This chart is also from /u/johnnydaggers:
[Link to original analysis](https://old.reddit.com/r/wallstreetbets/comments/l97ykd/the_real_reason_wall_street_is_terrified_of_the/?utm_source=reddit&utm_medium=usertext&utm_name=wallstreetbets&utm_content=t1_glj2msx
)",36826,2820,1612143477.0,sec doj minutes public data suggests massive securities fraud hedge funds institutions created gamestop shares actually exist delivery,obligatory emoji short version short version review strategic failstodeliver data indicates institutional insiders may counterfeited massive number gamestop shares tried stop retail investors buying shares thursday million shares gme ever issued company institutions reported sec via f filings shares including gme stock owned ryan cohen already shares even exist top shares reportedly owned institutions retail investors may currently hold million shares counting long holdings call options itm otm include call options retail investors may already hold gme float actual company would definitive proof illegal activity highest levels financial system long version detailed analysis ujohnnydaggers chart also ujohnnydaggers link original analysishttpsoldredditcomrwallstreetbetscommentslykdtherealreasonwallstreetisterrifiedoftheutmsourceredditutmmediumusertextutmnamewallstreetbetsutmcontenttgljmsx
This is how I've felt all week. Why give up now?,,36794,964,1612474460.0,ive felt week give,
The Mormon church made a 900% return on GME. Forget the moon. GME is headed to the stars aboard the LDSS Nauvoo!,,36775,2674,1621366469.0,mormon church made return gme forget moon gme headed stars aboard ldss nauvoo,
GAMESTOP NAMES AMAZON'S ELLIOTT WILKE AS CHIEF GROWTH OFFICER 🚀🚀🚀🚀🚀,,36756,1188,1617101240.0,gamestop names amazons elliott wilke chief growth officer,
Bullish.,,36755,3298,1652545805.0,bullish,
Google helps Robinhood after swarm of negative reviews drops company to 1-star rating. Fuck Google and Robinhood,,36716,1890,1612016849.0,google helps robinhood swarm negative reviews drops company star rating fuck google robinhood,
Robinhood still plans restrictions on $GME for Monday. You should already be signed up with a new brokerage.,,36704,2749,1612139129.0,robinhood still plans restrictions gme monday already signed new brokerage,
Good Gourd,,36700,869,1610974272.0,good gourd,
"The GME Thread, Part 3.14, for January 27, 2021","Reddit's Engineering team has asked us to rotate threads more frequently because our load destroying their backend.

Keep up the good work!",36697,47114,1611775568.0,gme thread part january,reddits engineering team asked us rotate threads frequently load destroying backend keep good work
"Baby wake up, DFV posted on twitter",,36627,2220,1715558500.0,baby wake dfv posted twitter,
"UPDATE: Added 5,000 shares as promised. If this gets another 50k upvotes, I’ll add 10,000 more.",,36616,1144,1660876120.0,update added shares promised gets another k upvotes ill add,
"To Every 💩🧻🙌 Who Said The Preview Was Faked: Fuck You and Melvin too (Minneapolis, MN)",,36610,513,1612364688.0,every said preview faked fuck melvin minneapolis mn,
Say it with me. WE. ARENT. FUCKIN. SELLING.,,36594,1108,1611933092.0,say arent fuckin selling,
What would you say you do here?,,36525,615,1619054669.0,would say,
The big short,,36412,1128,1653739852.0,big short,
The House Always Wins,,36361,171,1686312340.0,house always wins,
You guys are engaging in market manipulation,"You see, announcing your positions on a public forum in an effort to try encouraging others to buy into similar positions, thereby creating a self-fulfilling prophecy, is clear-cut market manipulation!

Market manipulation is super illegal which is why everyone is calling for the markets to be regulated now!

-

^(Note: this is only illegal if you’re poor. If you do the *exact* same shit by announcing your positions on MSNBC if you’re a billionaire you’re okay.)",36314,2895,1611982086.0,guys engaging market manipulation,see announcing positions public forum effort try encouraging others buy similar positions thereby creating selffulfilling prophecy clearcut market manipulation market manipulation super illegal everyone calling markets regulated note illegal youre poor exact shit announcing positions msnbc youre billionaire youre okay
Elon trolls Jeff Bezos 24 hours after divorce announcement.,,36296,580,1547181666.0,elon trolls jeff bezos hours divorce announcement,
I want to thank you guys for saving my best friends life!,"Monday afternoon I took my best friend, an American Bully 2.5 year old dog, to the vet because he wasn't putting any weight on his back leg.

Turns out he needed knee surgery that costed $4,000.00. I broke down because I didn't have that much, didn't qualify for the payment plan, and it was either the surgery or wait till his other knee blew out then put him to sleep.

I put all the money I did have in GME around $97/ share & AMC at $4.84 Tuesday morning (a little less than $1k) with an exit plan to get out once I had enough for his surgery. This morning after market open I was able to sell enough to pay for his TPLO surgery! I am in tears and really grateful. Thank you everyone and good luck!

A pic of me and my best friend this group helped me save -  https://imgur.com/gallery/HBJ6h4S",36306,1197,1611759639.0,want thank guys saving best friends life,monday afternoon took best friend american bully year old dog vet wasnt putting weight back leg turns needed knee surgery costed broke didnt much didnt qualify payment plan either surgery wait till knee blew put sleep put money gme around share amc tuesday morning little less k exit plan get enough surgery morning market open able sell enough pay tplo surgery tears really grateful thank everyone good luck pic best friend group helped save httpsimgurcomgalleryhbjhs
