title,body,score,comments,created,cleaned_title,cleaned_body
Why should any American company ever act responsibly again?,"Whats the point of good corporate governance and fiscal responsibility? The companies that leveraged themselves to the moon, did stock buybacks to hyper-inflate their stock price, live on constant debt instead of good balance sheets are now being bailed out by unlimited QE. Free money to cover your mistakes. Why would anyone run a good business ever again? Just cheat and scheme and get bailed out later.

Edit: I am truly honored to be the number 1 post on WSB. To get validation from you autists and retards, the greatest American generation, is the peak moment of my life. Thank you all.

Edit 2: Many of you are saying this post is socialist. It is anti-capitalist. It is anti-wall street. It is none of that. My post is in fact about fixing capitalism so it is done the right way. Don't reward companies that are managed poorly and don't invest their profits wisely. Capitalism is about survival of the fittest and rewarding the winners not the schemers and cheaters. I'd rather have a profitable company that pays its workers livable wages, doesn't use sweat shop labor, doesn't pollute our environment, gives good quality healthcare, paid family leave, sick leave, maternity/paternity leave, reinvests in improving infrastructure, keeps low debt to equity, and has a 12 month emergency fund for a black swan event. Not companies that give all the money to the CEO and Board and nothing to the workers, do stock buy-backs with profits instead of improving infrastructure or saving for emergency funds. Let the greedy poorly run companies fail so we can invest only in good quality companies that treat their workers well. We will all make tons of profits in the market with well run companies and main street America will also be able to live a decent quality life. 

Edit 3: I am not a salty bear. In fact I want the market to do well. But this is not the way. Bailing out weak companies that didn't save for a black swan event because of CEO greed is just making this bubble bigger and bigger and it will only pop worse later on. JPow will ruin our market and the economy with this fake bubble with his printer. Let the market be free so we can shed weak companies and true capitalism can see a rise of the strong companies and the market can moon again.

JPow and his printer are really helping the Wall street elite. Jpow doesn't care about you. Now the tax payers are bailing out shadow banking. Junk bonds are risky loans that private equity, hedge funds, and other shadow banking institutions give out to desperate companies that can't get loans from regular banks anymore. That's why junk bonds are shadow banking instead of traditional banking. JPow is using his unlimited printer to BAILOUT and give free money to the shadiest and greediest characters of wall street and society in general - private equity, hedge fund managers, shady billionaires.

PE, hedgies, shady billionaires were screwed because the economy just halted and companies were going to default on these risky loans since they had no revenue coming in. This is who JPow is helping. He just bailed them all out by buying these risky junk bonds on the back of the American tax payer. You may become homeless and starve, but private equity, hedge fund managers, and shady billionaires will be made whole by the fed.",50007,2831,1586451659.0,american company ever act responsibly,whats point good corporate governance fiscal responsibility companies leveraged moon stock buybacks hyperinflate stock price live constant debt instead good balance sheets bailed unlimited qe free money cover mistakes would anyone run good business ever cheat scheme get bailed later edit truly honored number post wsb get validation autists retards greatest american generation peak moment life thank edit many saying post socialist anticapitalist antiwall street none post fact fixing capitalism done right way dont reward companies managed poorly dont invest profits wisely capitalism survival fittest rewarding winners schemers cheaters id rather profitable company pays workers livable wages doesnt use sweat shop labor doesnt pollute environment gives good quality healthcare paid family leave sick leave maternitypaternity leave reinvests improving infrastructure keeps low debt equity month emergency fund black swan event companies give money ceo board nothing workers stock buybacks profits instead improving infrastructure saving emergency funds let greedy poorly run companies fail invest good quality companies treat workers well make tons profits market well run companies main street america also able live decent quality life edit salty bear fact want market well way bailing weak companies didnt save black swan event ceo greed making bubble bigger bigger pop worse later jpow ruin market economy fake bubble printer let market free shed weak companies true capitalism see rise strong companies market moon jpow printer really helping wall street elite jpow doesnt care tax payers bailing shadow banking junk bonds risky loans private equity hedge funds shadow banking institutions give desperate companies cant get loans regular banks anymore thats junk bonds shadow banking instead traditional banking jpow using unlimited printer bailout give free money shadiest greediest characters wall street society general private equity hedge fund managers shady billionaires pe hedgies shady billionaires screwed economy halted companies going default risky loans since revenue coming jpow helping bailed buying risky junk bonds back american tax payer may become homeless starve private equity hedge fund managers shady billionaires made whole fed
Oh shiittt,,49995,832,1645271266.0,oh shiittt,
Who smiled,,49876,774,1587151408.0,smiled,
Soon we'll all be able to buy our own GameStop 🚀🚀🚀,,49838,1082,1611982074.0,soon well able buy gamestop,
💎🙌 Diamond Hands Cocktail 💎🙌,,49799,989,1617311917.0,diamond hands cocktail,
Oil is now expenzive,,49781,987,1568644092.0,oil expenzive,
"Ok, I definitely picked the wrong day to buy (intel 700k yolo update) ","https://preview.redd.it/i13f44py9bgd1.png?width=1401&format=png&auto=webp&s=11f19009b89a89a412cdfd9f1af5f25da310e3be

My plan going into this was to hold for a decade and my plan hasn't changed. It's going to be rough and I realize that. The past two days have been the scariest days of my life. My parents still don't know I've lost 1/3 of my inheritance. Every time I talk to them they can see how stressed I look and they keep asking me what's wrong and I don't know what to say. How can I possibly explain this to them? My only option is to hold for a decade. So that's what I'm going to do. I know people are going to shit on me, and you should. I recognize I made an unnecessarily regarded decision. I have received a lot of DMs and reddit notifications offering me mental help and Suicide hotline numbers. I appreciate your concern but I'm fine. I'm holding long term. I'm sorry if my decision made you upset and reflect on your financial situation, that was not my intention. I appreciate all of your support and constructive criticism. Some of you have been really mean but its ok, I know I deserve it. But im holding. Forever. Intel will succeed. ",49710,8890,1722631669.0,ok definitely picked wrong day buy intel k yolo update,httpspreviewredditifpybgdpngwidthformatpngautowebpsfbaacdfdfaffdaebe plan going hold decade plan hasnt changed going rough realize past two days scariest days life parents still dont know ive lost inheritance every time talk see stressed look keep asking whats wrong dont know say possibly explain option hold decade thats im going know people going shit recognize made unnecessarily regarded decision received lot dms reddit notifications offering mental help suicide hotline numbers appreciate concern im fine im holding long term im sorry decision made upset reflect financial situation intention appreciate support constructive criticism really mean ok know deserve im holding forever intel succeed
I framed this beauty back in 2017 for my office,,49553,1840,1654269056.0,framed beauty back office,
"The SEC Just posted the new numbers for Failure to Deliver. Guess What, GME is failing to deliver every day.","Hey 'Tards,

The  New Failure to deliver data is JUST OUT from the SEC.  Here is a simple pivot table.   It's still failing to deliver EVERY DAY.  I'm sure people will analyze this better than me.   But I wanted to get this out to everyone ASAP.

Edit: Failure to deliver is how many shares were not accounted for at the end of the day.  GME has been failing to deliver in some capacity for weeks now.  This data is posted by the SEC Freedom of  Information Act (FOIA).  It is only posted every two weeks, for the previous two weeks.  But this is the most recent data that everyone has been waiting on.

From the SEC regarding this data

>""The   figure is not a daily amount of fails, but a combined figure that  includes both new fails on the reporting day as well as existing fails.    In other words, these numbers reflect aggregate fails as of a specific    point in time, and may have little or no relationship to yesterday's    aggregate fails.""

&#x200B;

SEC FOIA Site: [https://www.sec.gov/data/foiadocsfailsdatahtm](https://www.sec.gov/data/foiadocsfailsdatahtm)

Data File: [https://www.sec.gov/files/data/fails-deliver-data/cnsfails202101b.zip](https://www.sec.gov/files/data/fails-deliver-data/cnsfails202101b.zip)

&#x200B;

GME had 2 million shares failed to deliver one day totaling 300 million $

https://preview.redd.it/o2xfxx2gyuh61.png?width=581&format=png&auto=webp&s=67d839f263c89c56f782a52803b11c9e5f4c9c8b

EDIT: Because so many people are bringing up XRT.  Which contains a lot of GME. Here is XRT.  Hmmm.  Notice anything interesting about Jan29th between these two??

https://preview.redd.it/kmbry5xzgvh61.png?width=620&format=png&auto=webp&s=5ea1c495f4287932b0c6f9b172a04a03f58d147b

&#x200B;

&#x200B;

There is also AMC... AMC is still failing to deliver EVERY DAY.  This continues the trend for both of these stocks not being delivered every day.  AMC had 27 million... yes million shares failed to deliver.

&#x200B;

https://preview.redd.it/gqgboikxyuh61.png?width=619&format=png&auto=webp&s=2a12b0466767e0eba40dd93ba0a28cc322db1d32

&#x200B;

I'd like to ask everyone to do what they can.  I am not recommending buying any of these stocks.  But there is for sure, something still going on.  We need to try and get this data daily.  Contact your reps, etc.

&#x200B;

There are links to information about Failed to deliver.[https://www.sec.gov/rules/final/34-50103.htm](https://www.sec.gov/rules/final/34-50103.htm)

Is GME considered a Threshold Security? ✅

>In   order to be deemed a  threshold security, and thus subject to the   restrictions of Rule  203(b)(3), a security must exceed the specified   fail level for a period  of five consecutive settlement days.    Similarly, in order to be removed  from the list of threshold   securities, a security must not exceed the  specified level of fails for   a period of five consecutive settlement  days.

Does the Firm have to close out the positions? ✅

>As adopted, Rule 203(b)(3) requires any participant of a registered clearing agency (""participant"")[80](https://www.sec.gov/rules/final/34-50103.htm#P210_72014) to take action on all failures to deliver that exist in such securities ten days after the normal settlement date, *i.e.*, 13 consecutive settlement days.[81](https://www.sec.gov/rules/final/34-50103.htm#P211_72496)Specifically,  the participant is required to close out the fail to   deliver position  by purchasing securities of like kind and quantity.Rule 203(b)(3) is intended to address potential abuses that may occur with large, extended fails to deliver.[89](https://www.sec.gov/rules/final/34-50103.htm#P221_79239)  We believe that the five-day requirement will facilitate the identification of securities with extended fails.

&#x200B;

Edit:  I wrote a quick post about this last report.  I'll copy some stuff here.  AS requested, here are some data snippets for ""normal"" stocks.  note the number of failed to deliver is way lower.

[Alcoa](https://preview.redd.it/iv7pzbh92vh61.png?width=333&format=png&auto=webp&s=9b724af7998ca1bc1b4dd5db3299b45358eac540)

&#x200B;

[MSFT.  Some outstanding shares and a few spikes, but not hundreds of thousands or millions every day. ](https://preview.redd.it/0ricfjkd2vh61.png?width=246&format=png&auto=webp&s=22b6638b1ff5fee09e9434b5d151389624ed7aeb)

&#x200B;

Edit:  Adding some historical counts for GME below.  I'm too lazy to combine the data right now, pulling from an older post of mine.

&#x200B;

https://preview.redd.it/9o10fkj2wvh61.png?width=642&format=png&auto=webp&s=17134e3775fba124959db68eb25cda803504d63e

https://preview.redd.it/c0i6ixztvvh61.png?width=605&format=png&auto=webp&s=02ab76207deea9f208f54532a75b28761858e106

&#x200B;

&#x200B;

Edit:  I have a super super small position in GME, like 3 shares.  I have been on WSB since like 2014.  Trust me.  I am NOT a bag-holding whiner.  I take my losses like a fucking champ.  (MSFT 240C, USO, PRPL, SLV in 2020, etc) I am also NOT promoting any sort of holding, buying, or selling any of your positions.",49445,3424,1613489522.0,sec posted new numbers failure deliver guess gme failing deliver every day,hey tards new failure deliver data sec simple pivot table still failing deliver every day im sure people analyze better wanted get everyone asap edit failure deliver many shares accounted end day gme failing deliver capacity weeks data posted sec freedom information act foia posted every two weeks previous two weeks recent data everyone waiting sec regarding data figure daily amount fails combined figure includes new fails reporting day well existing fails words numbers reflect aggregate fails specific point time may little relationship yesterdays aggregate fails xb sec foia site httpswwwsecgovdatafoiadocsfailsdatahtmhttpswwwsecgovdatafoiadocsfailsdatahtm data file httpswwwsecgovfilesdatafailsdeliverdatacnsfailsbziphttpswwwsecgovfilesdatafailsdeliverdatacnsfailsbzip xb gme million shares failed deliver one day totaling million httpspreviewredditoxfxxgyuhpngwidthformatpngautowebpsdfccfabcefccb edit many people bringing xrt contains lot gme xrt hmmm notice anything interesting janth two httpspreviewredditkmbryxzgvhpngwidthformatpngautowebpseacfbcfbaafdb xb xb also amc amc still failing deliver every day continues trend stocks delivered every day amc million yes million shares failed deliver xb httpspreviewredditgqgboikxyuhpngwidthformatpngautowebpsabeebaddbaaccdbd xb id like ask everyone recommending buying stocks sure something still going need try get data daily contact reps etc xb links information failed deliverhttpswwwsecgovrulesfinalhtmhttpswwwsecgovrulesfinalhtm gme considered threshold security order deemed threshold security thus subject restrictions rule b security must exceed specified fail level period five consecutive settlement days similarly order removed list threshold securities security must exceed specified level fails period five consecutive settlement days firm close positions adopted rule b requires participant registered clearing agency participanthttpswwwsecgovrulesfinalhtmp take action failures deliver exist securities ten days normal settlement date ie consecutive settlement dayshttpswwwsecgovrulesfinalhtmpspecifically participant required close fail deliver position purchasing securities like kind quantityrule b intended address potential abuses may occur large extended fails deliverhttpswwwsecgovrulesfinalhtmp believe fiveday requirement facilitate identification securities extended fails xb edit wrote quick post last report ill copy stuff requested data snippets normal stocks note number failed deliver way lower alcoahttpspreviewredditivpzbhvhpngwidthformatpngautowebpsbafcabcbdddbbeac xb msft outstanding shares spikes hundreds thousands millions every day httpspreviewredditricfjkdvhpngwidthformatpngautowebpsbbfffeeebdedaeb xb edit adding historical counts gme im lazy combine data right pulling older post mine xb httpspreviewredditofkjwvhpngwidthformatpngautowebpsefbadbebcdade httpspreviewredditciixztvvhpngwidthformatpngautowebpsabdeeaffabe xb xb edit super super small position gme like shares wsb since like trust bagholding whiner take losses like fucking champ msft c uso prpl slv etc also promoting sort holding buying selling positions
Robinhood is facing nearly 50 lawsuits over GameStop frenzy.,,49349,1534,1614653379.0,robinhood facing nearly lawsuits gamestop frenzy,
My ancestor 50 000 BCE.,,49340,440,1639670065.0,ancestor bce,
DONT FALL FOR THE FAKE BS REPORT BY CNBC,"Melvin capital have not closed their positions!! The volume is too low for it to be even possible. The short interest has not changed! 

The squeeze has not been squoze.

FUCK YOU MELVIN AND FUCK YOU CITRON. WERE COMING AFTER YOUR SHORTS🚀🚀🚀

BUY THE DIP AND HOLD 🚀 WERE HITTING 1000 FRIDAY 

I LIKE THIS STOCK I WILL BUY MORE",49019,2474,1611748040.0,dont fall fake bs report cnbc,melvin capital closed positions volume low even possible short interest changed squeeze squoze fuck melvin fuck citron coming shorts buy dip hold hitting friday like stock buy
"Me trying to ""perfectly"" time buying the dip",,49017,794,1616272007.0,trying perfectly time buying dip,
420.69 at premarket - sign from the Stonk Gods,,48985,1497,1611913699.0,premarket sign stonk gods,
Short Airbnb Inc???,,48891,2393,1675014143.0,short airbnb inc,
Guys I’m sorry I panicked and bought more🚀🚀🚀🚀🚀🚀💎🙌🏽💎🙌🏽,,48774,1246,1612280623.0,guys im sorry panicked bought,
"Get a job at the company which you know is going to be acquired to get some stonks as compensation. No insider trading, no legal problem.",,48760,1027,1642604180.0,get job company know going acquired get stonks compensation insider trading legal problem,
"My dad, working through a 15-hour time zone difference almost every day",,48746,1597,1568131337.0,dad working hour time zone difference almost every day,
#truestory,,48652,1057,1657395293.0,truestory,
My wife just told me she's pregnant with our 2nd!! 🥳 A) sweet! B) THANK YOU WSB FOR THESE 3M RETURNS! I'm on track to retire early and spend time with my kids 🙂🥲😭,,48523,2012,1612576231.0,wife told shes pregnant nd sweet b thank wsb returns im track retire early spend time kids,
UPDATE: $GME in full Phineas mode,,48442,779,1614741900.0,update gme full phineas mode,
DeepFuckingValue position update | GME,,48421,1234,1613964107.0,deepfuckingvalue position update gme,
"GME Megathread for March 10, 2021",HOLYMOLYHOLYMOLYHOLYMOLYHOLYMOLYHOLYMOLYHOLYMOLYHOLYMOLYHOLYMOLYHOLYMOLYHOLYMOLYHOLYMOLYHOLYMOLYHOLYMOLYHOLYMOLYHOLYMOLYHOLYMOLYHOLYMOLYHOLYMOLYHOLYMOLYHOLYMOLYHOLYMOLYHOLYMOLYHOLYMOLYHOLYMOLYHOLYMOLYHOLYMOLYHOLYMOLYHOLYMOLYHOLYMOLYHOLYMOLYHOLYMOLYHOLYMOLYHOLYMOLYHOLYMOLYHOLYMOLYHOLYMOLYHOLYMOLYHOLYMOLYHOLYMOLYHOLYMOLYHOLYMOLYHOLYMOLYHOLYMOLYHOLYMOLYHOLYMOLYHOLYMOLYHOLYMOLYHOLYMOLYHOLYMOLYHOLYMOLYHOLYMOLYHOLYMOLYHOLYMOLYHOLYMOLYHOLYMOLYHOLYMOLYHOLYMOLYHOLYMOLYHOLYMOLYHOLYMOLY,48315,87809,1615383011.0,gme megathread march,holymolyholymolyholymolyholymolyholymolyholymolyholymolyholymolyholymolyholymolyholymolyholymolyholymolyholymolyholymolyholymolyholymolyholymolyholymolyholymolyholymolyholymolyholymolyholymolyholymolyholymolyholymolyholymolyholymolyholymolyholymolyholymolyholymolyholymolyholymolyholymolyholymolyholymolyholymolyholymolyholymolyholymolyholymolyholymolyholymolyholymolyholymolyholymolyholymolyholymolyholymolyholymolyholymolyholymolyholymolyholymolyholymolyholymolyholymolyholymoly
Found an autismobile belonging to a fellow ape!!! 🦍💎👐🚀,,48312,948,1615328219.0,found autismobile belonging fellow ape,
if JPow gives up trying to correct asset (real estate) inflation….,,48302,920,1675269319.0,jpow gives trying correct asset real estate inflation,
[LEAKED] WSB Top Minds Developing DD,,48087,1164,1619106038.0,leaked wsb top minds developing dd,
She doesn’t understand.,,48049,1665,1670968786.0,doesnt understand,
RoobinHOOD,,48018,341,1637769242.0,roobinhood,
Stocks only go up,,48016,1025,1631809321.0,stocks go,
I see dead hedge funds,,47949,661,1611799596.0,see dead hedge funds,
8.6% 🤡,,47884,813,1654865606.0,,
"GME Megathread Part 2 for March 10, 2021","EMERGENCY SECOND GME MEGATHREAD

HOLY MOLY

EDIT: STOP REPORTING THIS AS SPAM r/ALL",47759,65933,1615397721.0,gme megathread part march,emergency second gme megathread holy moly edit stop reporting spam rall
President Biden calls to double capital gains tax from 20% to 40%.,,47681,3813,1678380278.0,president biden calls double capital gains tax,
"Swedish news - Over 50k swedes is still holding $GME, me included. Swedish apes still strong.",,47666,1240,1613634387.0,swedish news k swedes still holding gme included swedish apes still strong,
She belongs here,,47650,1000,1606704079.0,belongs,
I hope as a community we can respect /u/DeepFuckingValue's decision if/when he decides to sell $GME and not flip out on a guy who's never once said he's planning to hold till the end of time.,"I feel like with /u/deepfuckingvalue being positioned as the figurehead of the $GME movement and the 'if he is still in I'm still in' crowd that some people may feel betrayed if he decided to sell his whole position and take profits.

Just remember that when DFV was buying $GME at prices as low as $4 per share he wasn't signing up for the 'diamond hands never sell' club and he never got into the play for reasons like smashing hedge funds, curing cancer etc. That stuff has all come about from us and people jumping on the bandwagon.

WSB before this crazy week that has changed the sub forever was all about taking on risk to try and make money fast. DFV has achieved that on a scale we haven't seen before and if he decides to take profits we should support him doing so and not get upset that it may affect the price etc or say he betrayed a cause he never signed up for.

If you've watched the guys youtube you will know he's an extremely nice and likeable guy, would hate to see people calling him judas or whatever if he decides to sell.",47644,1838,1612233416.0,hope community respect udeepfuckingvalues decision ifwhen decides sell gme flip guy whos never said hes planning hold till end time,feel like udeepfuckingvalue positioned figurehead gme movement still im still crowd people may feel betrayed decided sell whole position take profits remember dfv buying gme prices low per share wasnt signing diamond hands never sell club never got play reasons like smashing hedge funds curing cancer etc stuff come us people jumping bandwagon wsb crazy week changed sub forever taking risk try make money fast dfv achieved scale havent seen decides take profits support get upset may affect price etc say betrayed cause never signed youve watched guys youtube know hes extremely nice likeable guy would hate see people calling judas whatever decides sell
"Don‘t forget to get your bananas, because „Monkey never cramps“ 🍌🦍",,47468,688,1615756760.0,dont forget get bananas monkey never cramps,
"i'm about to YOLO my $800k life savings on starbucks gift cards, what are the tax implications ??","hey wsb i'm going to invest my life savings in starbucks gift cards cause i think the dollar is going to go down, i plan to sell them in a couple years and make an absolute killing

what are the tax implications of doing this??

what kind of investment vehicle are starbucks gift cards anyway? my polyamorous girlfriend says that they're most similar to bearer bonds, which makes sense; does that tie their value to starbucks' capitalization?",47456,4201,1617549756.0,im yolo k life savings starbucks gift cards tax implications,hey wsb im going invest life savings starbucks gift cards cause think dollar going go plan sell couple years make absolute killing tax implications kind investment vehicle starbucks gift cards anyway polyamorous girlfriend says theyre similar bearer bonds makes sense tie value starbucks capitalization
The Stock Market Today Be Like,,47451,1067,1637962467.0,stock market today like,
"Thanks to $TSLA, I’m buying a new wife for Christmas.",,47298,3411,1636823109.0,thanks tsla im buying new wife christmas,
SHARE AND UPVOTE. Screw Wall Street. We need to make our trading platform for retail traders only.,,47220,1769,1611851696.0,share upvote screw wall street need make trading platform retail traders,
Nice,,47213,1801,1623974635.0,nice,
Pelosi strikes again,,47167,2004,1674679619.0,pelosi strikes,
