title,body,score,comments,created,cleaned_title,cleaned_body
"A dark part WallStreetBets history, and why it's important for you to know and remember","Edit 02/04: not a week since this post was made, here we fucking go again. History rhymes and people don’t fucking learn. If 🅱️artek didn’t get away with it, you won’t either. 

Edit 02/04 #2: [We did it Reddit](https://reddit.com/r/wallstreetbets/comments/lcvluc/an_update_on_the_wsb_coup_d%C3%A9tat/)! 


tl;dr on tl;dr: Founder bad, greedy, got banned for being greedy. Being greedy again with new spotlight on the sub. 

tl;dr, in 2020 the original founder (after being gone for years and did nothing to contribute to the sub), along with a couple of mods, attempted to monetize the sub for personal gains. Users and other mods fought back. Hundreds of users got mass banned for speaking out, mods who spoke out got removed as mods. With some help from users, mods found precedent of another sub creator getting banned for trying to monetize a sub and sent plea to Reddit admins. Reddit admins banned offenders and gave sub back to the good mods. 

u/SpeaksInBooleans (RIP) investigated the circumstance of the events and made video exposing the offenders:

[Part 1](https://www.youtube.com/watch?v=caoF3jH7yG4)

[Part 2](https://www.youtube.com/watch?v=OIFI7YzmAVI)

[Part 3](https://www.youtube.com/watch?v=UcgvEVyzFlE)

[Part 4](https://www.youtube.com/watch?v=4oaA2MP1WD4)

[Part 5](https://www.youtube.com/watch?v=ecmL9UOINH0)

[Part 6](https://www.youtube.com/watch?v=5CUqskfiRIE)

[Mega thread after the victory](https://www.reddit.com/r/wallstreetbets/comments/fx5zwf/ladies_and_gentlemen_we_got_him/) for reference. 

It's important to know/remember this now, because the same person that got exiled for being a tyrant is doing a media circus, trying to ride the current spotlight for personal gain, again. Hey CNN and WSJ, stop interviewing that dipshit. The sub has always been about its people, and what you guys wanted to do (as retarded as you are). No single person speaks for the sub and controls its destiny. It is in good hands with u/zjz aka u/SwineFluPandemic

Edit: He is spreading complete lies about the sub and the mods that got him removed:

>	Despite being its founder, Rogozinski was kicked out of the forum in April for trying to eliminate the hate speech plaguing the community.

>“There were a handful of mods who were straight up white supremacists,” he said.

>“I have really thick skin and people can say whatever they want to me, but at some point there’s a moral standpoint — like with my kids, I don’t want them to think, ‘Well, they can say whatever they want about you,’” he told the paper.",67272,2426,1611873178.0,dark part wallstreetbets history important know remember,edit week since post made fucking go history rhymes people dont fucking learn artek didnt get away wont either edit reddithttpsredditcomrwallstreetbetscommentslcvlucanupdateonthewsbcoupdcatat tldr tldr founder bad greedy got banned greedy greedy new spotlight sub tldr original founder gone years nothing contribute sub along couple mods attempted monetize sub personal gains users mods fought back hundreds users got mass banned speaking mods spoke got removed mods help users mods found precedent another sub creator getting banned trying monetize sub sent plea reddit admins reddit admins banned offenders gave sub back good mods uspeaksinbooleans rip investigated circumstance events made video exposing offenders part httpswwwyoutubecomwatchvcaofjhyg part httpswwwyoutubecomwatchvoifiyzmavi part httpswwwyoutubecomwatchvucgvevyzfle part httpswwwyoutubecomwatchvoaampwd part httpswwwyoutubecomwatchvecmluoinh part httpswwwyoutubecomwatchvcuqskfirie mega thread victoryhttpswwwredditcomrwallstreetbetscommentsfxzwfladiesandgentlemenwegothim reference important knowremember person got exiled tyrant media circus trying ride current spotlight personal gain hey cnn wsj stop interviewing dipshit sub always people guys wanted retarded single person speaks sub controls destiny good hands uzjz aka uswineflupandemic edit spreading complete lies sub mods got removed despite founder rogozinski kicked forum april trying eliminate hate speech plaguing community handful mods straight white supremacists said really thick skin people say whatever want point theres moral standpoint like kids dont want think well say whatever want told paper
YOU NEVER SEE THEM IN THE SAME ROOM,,67253,2044,1612050567.0,never see room,
How to get oil back up,,67121,555,1587431901.0,get oil back,
RH eases restrictions again in AMC and GME,,66964,3953,1612405608.0,rh eases restrictions amc gme,
I bought 1 share of Blockbuster🌚,,66897,2567,1619309685.0,bought share blockbuster,
CNBC thinks loss porn isn't a thing!,,66725,2028,1611972823.0,cnbc thinks loss porn isnt thing,
Outperforming the stock market 😂,,66632,835,1641824621.0,outperforming stock market,
Live footage of me and the guys buying the dips these days 🥴,,66612,2066,1614907738.0,live footage guys buying dips days,
"I’m pleased to announce my weekly GME gains of $69,694.20. Very bullish for Monday with these good luck numbers!",,66497,1624,1612154414.0,im pleased announce weekly gme gains bullish monday good luck numbers,
"6M in GameStop GME. Following through. Can’t stop, won’t stop, lift off",,65848,3199,1611700629.0,gamestop gme following cant stop wont stop lift,
We did it boys - we saved the movie theater industry from COVID so we can enjoy premieres together when it ends! 🚀 Has anyone else also missed the theater experience?,,65836,4147,1611948222.0,boys saved movie theater industry covid enjoy premieres together ends anyone else also missed theater experience,
I guess they didn’t like my “printer goes brrrrr” posts every day.,,65814,1016,1591963508.0,guess didnt like printer goes brrrrr posts every day,
Got Em,,65786,742,1654771253.0,got em,
BREAKING NEWS: Twitter will not go public again in 5 years because it will be dead by that time,,65487,4704,1667312590.0,breaking news twitter go public years dead time,
We lost to a fish,,65194,1112,1648771283.0,lost fish,
Lots of Ass Tattoos coming soon!,,65097,765,1614265853.0,lots ass tattoos coming soon,
Oh my god I'm going to fucking pass out.,,65052,3492,1614200301.0,oh god im going fucking pass,
When will the dip dip???,,64913,1079,1620328286.0,dip dip,
We have become fearless,,64913,1464,1617985118.0,become fearless,
Congressman Calls Robinhood CEOs Bluff and Calls Help Line During Hearing. He Gets sent Voicemail,,64847,2770,1613695938.0,congressman calls robinhood ceos bluff calls help line hearing gets sent voicemail,
Always buy the dip!,,64680,1045,1611847990.0,always buy dip,
Fucking legend,,64559,2301,1644074649.0,fucking legend,
THEY'VE GOT NO BULLETS,,64458,851,1611947880.0,theyve got bullets,
I made a promise to some friends that I would eat a green crayon if GME hit $250. Might as well show you apes as well.,,64457,3712,1615361400.0,made promise friends would eat green crayon gme hit might well show apes well,
Bought at the top to encourage you retards to not give up,,64356,4304,1611763106.0,bought top encourage retards give,
GME Megathread,"Keep it all here. Please.

We love you guys too. Be kind to each other.",64144,64917,1611851237.0,gme megathread,keep please love guys kind
They are going after DeepFuckinvValue,,64069,3517,1613583345.0,going deepfuckinvvalue,
Friendly Reminder: Inflation Rate,,63987,1357,1623309401.0,friendly reminder inflation rate,
My portfolio the entire fucking month,,63971,1840,1614961001.0,portfolio entire fucking month,
Stimmy Gang WYA,,63791,362,1608651002.0,stimmy gang wya,
u/deepfuckingvalue hitting front pages out here in Canada 🚀🚀🚀🚀🌑🌑🌑🚀🚀,,63794,1633,1612052965.0,udeepfuckingvalue hitting front pages canada,
All in on nuclear war,,63742,873,1680444718.0,nuclear war,
New Robinhood commercial just dropped,,63716,1243,1613864858.0,new robinhood commercial dropped,
So i was reading Cramers book from 2006 XD,,63678,1555,1615941531.0,reading cramers book xd,
"GameStop, AMC short sellers sit on nearly $1 billion loss.",,63637,3134,1621338691.0,gamestop amc short sellers sit nearly billion loss,
Diamond Hand Rocket Song,,63597,2227,1615166453.0,diamond hand rocket song,
😂,,63595,2006,1633049073.0,,
Am I financially free now?,,63567,538,1653944576.0,financially free,
Johnny Sins is with us!!! 🚀🚀🚀,,63494,989,1612214504.0,johnny sins us,
"Gentlemen, it has been a privilege and an honor gambling with you.",,63367,1713,1664929526.0,gentlemen privilege honor gambling,
Robinhood now blocks users from getting their statements. Statements are required if you want to transfer to another broker.,,63013,4485,1612046826.0,robinhood blocks users getting statements statements required want transfer another broker,
"GME gang, remember to give back. Tomorrow I'm paying it forward at our local hospital and buying coffee and donuts for our front lines. Those heroes deserve a fucking medal!","Friends, we've done good.  We're writing history, doing incredible things.  Brokers are on their knees.  Short selling hedge funds are over.  We have the ears of papa Elon, AOC, Mark Cuban, Jon Stewart, Shapiro, Ted Cruz, Donald Trump Jr, Rashida, and a slew of others.

🚀🚀🚀🚀🚀

While we're still holding, riding this rollercoaster bitch to the fucking moon, please remember to set something aside.  To give back.  To show we're a community of people with heart and soul.  This is an opportunity for us to be better than hedge funds who are fucking the little guy.

🚀🚀🚀🚀🚀

This isn't the last thing I'll do, but it's a start.  Once we've landed on Mars, more will be coming.  Tomorrow I'm dropping off $1K at my local hospital to buy coffee and donuts for our front lines.  These guys are heroes.  They're struggling.  Overworked, going through emotions, getting sick, some losing lives to a senseless disease.  Its the least I can do.  Find something you care about and give back.  It'll make this all seem so much more rewarding.

🚀🚀🚀🚀🚀

Positions: GME, BB, AMC, NOK and NAKD

WE LOVE THESE STOCKS

🎢🚀🚀🚀🌛🌛💰💰💰

Edit: I'm not selling.  Cash from under the mattress on this one, buying some good vibes for Monday.

Edit: OMG the fucking awards, I love you guys, a huge inspiration, but seriously please buy GME or spend the money on your favorite charity not me 🙏",62996,2628,1611962284.0,gme gang remember give back tomorrow im paying forward local hospital buying coffee donuts front lines heroes deserve fucking medal,friends weve done good writing history incredible things brokers knees short selling hedge funds ears papa elon aoc mark cuban jon stewart shapiro ted cruz donald trump jr rashida slew others still holding riding rollercoaster bitch fucking moon please remember set something aside give back show community people heart soul opportunity us better hedge funds fucking little guy isnt last thing ill start weve landed mars coming tomorrow im dropping k local hospital buy coffee donuts front lines guys heroes theyre struggling overworked going emotions getting sick losing lives senseless disease least find something care give back itll make seem much rewarding positions gme bb amc nok nakd love stocks edit im selling cash mattress one buying good vibes monday edit omg fucking awards love guys huge inspiration seriously please buy gme spend money favorite charity
Our Darkest Hour.,,62862,1178,1611886052.0,darkest hour,
Back in 2019 I dressed up as a literal gorilla chasing a banana to crash a finance midterm at my University. This is who the Hedge Funds are up against. 💎🦍🚀🚀🚀,,62865,1418,1622933319.0,back dressed literal gorilla chasing banana crash finance midterm university hedge funds,
DFV's Double Down Update Set Record for Most Awards on a Reddit Post,,62849,1135,1614994192.0,dfvs double update set record awards reddit post,
One of us. One of us,,62421,504,1640766697.0,one us one us,
Facebook will charge $12 a month to keep verified status.,,62329,1607,1676838233.0,facebook charge month keep verified status,
Here you go apes 💎🦍,,62160,1070,1617014888.0,go apes,
Why am I like this,,62143,971,1619192665.0,like,
At least we never have to worry about taxes,,62073,608,1641160770.0,least never worry taxes,
"Apes Together Strong $301,000 and counting",,62017,993,1615852917.0,apes together strong counting,
the very essence of r/wallstreetbets,,61867,494,1631453014.0,essence rwallstreetbets,
GameStop founder Gary Kusin said it was an 'honor' retail investors targeted the company: 'I just grabbed some popcorn' 🚀🚀🚀🚀,,61674,1099,1612148928.0,gamestop founder gary kusin said honor retail investors targeted company grabbed popcorn,
Our savior,,61604,1095,1649124531.0,savior,
SEC Intern pls read: False media reports about “Reddit traders” moving into ____ is clear market manipulation,"Dear SEC Intern,

Sorry not sorry you worked all weekend scouring memes and getting the tendieman song stuck in your head.

False media reports about “Reddit traders” moving en-mass into silver, SPACs, or whatever is benefiting hedge funds at the moment is getting out of control.

It doesn’t take more than 2 seconds and a smooth brain to pull up front page of WSB to see that nobody is talking about that shit (except for the bots).

This is a clear case of market manipulation to lure outside investors into a “momentum opportunity” by fraudulently invoking the “reddit army” for whatever is convenient. This shit is getting out of control.

Pls format the above into another SEC complaint  for me, kthxbai

💎🤚🚀🚀🚀",61530,873,1612180116.0,sec intern pls read false media reports reddit traders moving clear market manipulation,dear sec intern sorry sorry worked weekend scouring memes getting tendieman song stuck head false media reports reddit traders moving enmass silver spacs whatever benefiting hedge funds moment getting control doesnt take seconds smooth brain pull front page wsb see nobody talking shit except bots clear case market manipulation lure outside investors momentum opportunity fraudulently invoking reddit army whatever convenient shit getting control pls format another sec complaint kthxbai
WSB Hedge Fund,,61449,1635,1611761095.0,wsb hedge fund,
WSB: GME Infinity War,,61315,1897,1612875772.0,wsb gme infinity war,
Can anyone guess when I discovered options trading?,,61172,3102,1613323726.0,anyone guess discovered options trading,
You heard the man. YES,,60728,1289,1615319108.0,heard man yes,
Autism is the 6th element,,60627,1356,1638968072.0,autism th element,
"Gamestop, AMC short sellers lost $754 million after Tuesday's rally",,60415,2670,1622037379.0,gamestop amc short sellers lost million tuesdays rally,
WSB and Apes rn,,60147,930,1615692029.0,wsb apes rn,
Chappelle has our backs 🦍🚀💎🤲🏼,,59739,617,1614401528.0,chappelle backs,
"Wait, so reddit's going to become like youtube?? 🗿",,59718,3591,1639750159.0,wait reddits going become like youtube,
"Dian Fossey Gorilla Fund has updated their frontpage with ""APES STRONG TOGETHER"". 🦍🦍🦍🦍🦍",,59701,1070,1615731936.0,dian fossey gorilla fund updated frontpage apes strong together,
"Watching GME, waiting for it to Squeeze like:",,59603,1478,1616182816.0,watching gme waiting squeeze like,
GME realistic price prediction DD,,59306,1894,1615065771.0,gme realistic price prediction dd,
Which one of you picked up my wife in this?,,59133,1375,1633798610.0,one picked wife,
Key moments from DFV's testimony tomorrow,,58925,883,1613596241.0,key moments dfvs testimony tomorrow,
58th attempt at posting my fucking meme,,58888,1077,1611889154.0,th attempt posting fucking meme,
My investment vs Wall Street.,,58885,948,1622401897.0,investment vs wall street,
"Beware those who are shilling other stocks claiming they're the next GME! They're just trying to get your attention, and they're succeeding! 🚨","There is no next GME. As our beloved autist Michael Burry said, GME is a unique situation and a perfect storm. You won't find something like this again. They are just trying to move your attention away from GME and scatter us. From the discussion threads and the posts on the frontpage, it seems that they're succeeding.

[Michael Burry tweet on GME](https://twitter.com/michaeljburry/status/1355186794640236561?s=19)

Just look at the AMC thread up on the frontpage at the moment. Half the comments are from new accounts with just a handful of karma. AMC is not the next GME. The 'days to cover' on AMC is less than a day. After an initial uptick it will just fizzle out and you'll be left bagholding.

If you're still unsure, [here](https://www.nextmemestock.com/) you can find a highly advanced AI algorithm showing the next meme stock. (credits /u/adagiolifen)

Edit: I think we even need to the mods to make a post and sticky it. The shilling is really becoming bad now

Buy whatever the fuck you want and whatever you like. All I'm saying is it's not the next GME.",58642,5680,1612002902.0,beware shilling stocks claiming theyre next gme theyre trying get attention theyre succeeding,next gme beloved autist michael burry said gme unique situation perfect storm wont find something like trying move attention away gme scatter us discussion threads posts frontpage seems theyre succeeding michael burry tweet gmehttpstwittercommichaeljburrystatuss look amc thread frontpage moment half comments new accounts handful karma amc next gme days cover amc less day initial uptick fizzle youll left bagholding youre still unsure herehttpswwwnextmemestockcom find highly advanced ai algorithm showing next meme stock credits uadagiolifen edit think even need mods make post sticky shilling really becoming bad buy whatever fuck want whatever like im saying next gme
"I emailed a journalist to let him know that WSB is NOT buying silver. His response? He joined the community! Welcome retard, can we make this a trend? Let's open people's eyes to hats really going on. GME 🚀🚀🚀🚀🚀","Here's his article https://thegoldforecast.com/video/silver-benefits-redditt%E2%80%99s-wallstreetbets-forum-there-more-story

My email to him. 
Hi Gary I have read many articles similar to Yours in the past day that reddit users are behind this silver push. I'm sorry to say this is not the case. I understand you implied that according to CNBC reports it isn't understood whether it is longtime reddit users or perhaps larger organisations at play here. I don't consider myself a long time user but I joined the community at a mere 1.8m members. That number in the few months I have been a wallstreetbets member has ballooned to 8milion+. I would urge you to check out the site and see for yourself the overwhelming sentiment that silver is simply a distraction. We love GME stock, we are not bored of it and the due diligence shows evidence that an extraordinary short interest DOES still exist for it. It would be wonderful to see a detailed article on this and I'm CERTAIN this would attract a lot more attention and clicks than another WSB LOVES SLV article. I'm not trying to demean your work in any way. 
Hope you have nice day, all the best. 
Yours, Jordan. 

P.S I really appreciate that your email address is on your article because even if I don't get a reply it makes you seem very easy to contact... A feature not shared with a lot of journalists. So thank you! 

His response: 

jordan

Thanks for your email. I want to report the truth as accurate as possible. So your email helps me clarify what is really going on. I did join the site over the weekend.

Gary Wagner

Let's send journalists some love and welcome them because we need all the help we can get against MSM

Edit - I've had quite a lot of messages concerning WSB's interest in silver dating back from long ago, long before I was a member so I just wanted to clarify something. 
Here is a clarification : 
I wanted to reflect the disparity between how few silver posts I was seeing on wsb in and around the time of the media hype and how so many media outlets were pushing the "" WSB's next target is silver!"" agenda. Of course this community is so big that there must be lots of diversity and it was a little ham-fisted to suggest nobody on the sub is buying silver. The important point in my mind was that MSM as I saw it had blanket reported something about the subreddit I believed was an inaccurate representation of the real sentiment.",58614,1345,1612353619.0,emailed journalist let know wsb buying silver response joined community welcome retard make trend lets open peoples eyes hats really going gme,heres article httpsthegoldforecastcomvideosilverbenefitsredditteswallstreetbetsforumtheremorestory email hi gary read many articles similar past day reddit users behind silver push im sorry say case understand implied according cnbc reports isnt understood whether longtime reddit users perhaps larger organisations play dont consider long time user joined community mere members number months wallstreetbets member ballooned milion would urge check site see overwhelming sentiment silver simply distraction love gme stock bored due diligence shows evidence extraordinary short interest still exist would wonderful see detailed article im certain would attract lot attention clicks another wsb loves slv article im trying demean work way hope nice day best jordan ps really appreciate email address article even dont get reply makes seem easy contact feature shared lot journalists thank response jordan thanks email want report truth accurate possible email helps clarify really going join site weekend gary wagner lets send journalists love welcome need help get msm edit ive quite lot messages concerning wsbs interest silver dating back long ago long member wanted clarify something clarification wanted reflect disparity silver posts seeing wsb around time media hype many media outlets pushing wsbs next target silver agenda course community big must lots diversity little hamfisted suggest nobody sub buying silver important point mind msm saw blanket reported something subreddit believed inaccurate representation real sentiment
I Feel Targeted,,58545,523,1603470933.0,feel targeted,
A GME story.,,58495,2114,1612620916.0,gme story,
They say history repeats itself,,58251,1538,1612484230.0,say history repeats,
Day 1 of GameStop Hearing - House Committee on Financial Services,,58225,1215,1613247730.0,day gamestop hearing house committee financial services,
