title,body,score,comments,created,cleaned_title,cleaned_body
Times Square right now,,487827,13997,1612029638.0,times square right,
UPVOTE so everyone sees we got SUPPORT,,338176,12851,1611841234.0,upvote everyone sees got support,
GME YOLO update — Jan 28 2021,,300493,23039,1611867983.0,gme yolo update jan,
GME YOLO month-end update — Jan 2021,,264677,19918,1611954285.0,gme yolo monthend update jan,
It’s treason then,,247126,4601,1611963659.0,treason,
"CLASS ACTION AGAINST ROBINHOOD. Allowing people to only sell is the definition of market manipulation. A class action must be started, Robinhood has made plenty of money off selling info about our trades to the hedge funds to be able to pay out a little for causing people to loose money now","LEAVE ROBINHOOD. They dont deserve to make money off us after the millions they caused in losses. It might take a couple of days, but send Robinhood to the ground and GME to the moon.",228308,17850,1611841751.0,class action robinhood allowing people sell definition market manipulation class action must started robinhood made plenty money selling info trades hedge funds able pay little causing people loose money,leave robinhood dont deserve make money us millions caused losses might take couple days send robinhood ground gme moon
GME YOLO update — Feb 19 2021,,224537,12896,1613768755.0,gme yolo update feb,
GME YOLO update — Jan 27 2021 --------------------------------------- guess i need 102 characters in title now,,218624,14663,1611782135.0,gme yolo update jan guess need characters title,
GME YOLO update — Feb 1 2021,,217440,18072,1612213656.0,gme yolo update feb,
IT'S POWER TO THE TRADERS NOW,,216263,5645,1611884158.0,power traders,
"Used some of my GME tendies to buy Nintendo Switches from Gamestop, then donated them to a Children's Hospital. Got featured on the local news and brought glory to WSB.",,215177,7000,1611975220.0,used gme tendies buy nintendo switches gamestop donated childrens hospital got featured local news brought glory wsb,
That’s what I thought,,201916,4550,1611966275.0,thats thought,
Can we all take a moment and appreciate the Mods who have grinded through this and held our community together. Thank you.,,197720,6816,1611795452.0,take moment appreciate mods grinded held community together thank,
"It runs very deep, my friends.",,194069,2771,1611870475.0,runs deep friends,
I am proud to do my part in paying forward our good fortune with a donation of 6 Nintendo Switches and games to go with them to the Children’s Minnesota Hospital. Cant Stop. Won’t Stop. GameStop. (Still long 50 shares I WILL NOT SELL),,190010,3808,1612055063.0,proud part paying forward good fortune donation nintendo switches games go childrens minnesota hospital cant stop wont stop gamestop still long shares sell,
Crazy mannnnnnn. We can't let this slide at all,,189719,2376,1611859321.0,crazy mannnnnnn cant let slide,
Drew this for you my fellow retards 💎🙌🏼,,186424,3467,1612123498.0,drew fellow retards,
Mark Cuban spent nearly 2 hours answering questions in his AMA. And then immediately called into CNBC to defend WSB!,,182243,4357,1612283143.0,mark cuban spent nearly hours answering questions ama immediately called cnbc defend wsb,
I’m so proud of you all.,,181017,2413,1611869601.0,im proud,
WE'RE IN THE ENDGAME NOW,,177333,6431,1611908502.0,endgame,
GME YOLO update — Apr 16 2021 — final update,,175735,17883,1618604413.0,gme yolo update apr final update,
WSB right now,,173634,4134,1612305128.0,wsb right,
In honor of finally seeing the almighty u/deepfuckingvalue. We must now do our part in having him written in the history books as the greatest that WallStreetBets has ever seen.,,173415,3728,1611943114.0,honor finally seeing almighty udeepfuckingvalue must part written history books greatest wallstreetbets ever seen,
GME YOLO update — Mar 8 2021,,171920,8075,1615237711.0,gme yolo update mar,
Congress might do something for once,,168693,6661,1611875915.0,congress might something,
A message to WSB from the Director of the Dian Fossey Gorilla Fund!,,167024,5911,1615677272.0,message wsb director dian fossey gorilla fund,
GME YOLO update — Feb 2 2021,,161686,17434,1612300308.0,gme yolo update feb,
"Not sure if anyone posted this here, but yikes",,161220,5719,1611874211.0,sure anyone posted yikes,
"Hey everyone, Its Mark Cuban. Jumping on to do an AMA.... so Ask Me Anything",Lets Go !,159696,26323,1612276523.0,hey everyone mark cuban jumping ama ask anything,lets go
IMPORTANT!! THERE ARE NO SELLERS!!! DO NOT PANIC IF YOU SEE PRICE DROP HOLD THE LINE! UPVOTE SO PEOPLE DON’T PANIC.,,159058,4888,1611849005.0,important sellers panic see price drop hold line upvote people dont panic,
Doing my part,,157789,2775,1611868230.0,part,
Our favourite analyst. 🚀🚀🙌💎🌕,,156277,4097,1612035971.0,favourite analyst,
Forever never dies 🥰,,155055,2771,1612060560.0,forever never dies,
In case you needed proof that there are imposters among us. A bot posting the same negative sentiment comment multiple times per minute 🌈🐻,,152432,5898,1612216853.0,case needed proof imposters among us bot posting negative sentiment comment multiple times per minute,
GME YOLO month-end update — Feb 2021,,150732,7651,1614373638.0,gme yolo monthend update feb,
Mic drop,,150354,1815,1611871924.0,mic drop,
Fake news 🤣,,149180,6039,1612200400.0,fake news,
GME YOLO update — Feb 3 2021 – heads up gonna back off the daily updates for now,,147958,9963,1612387105.0,gme yolo update feb heads gon na back daily updates,
"WSB PIONEER. FEARLESS BAG HOLDER. BETTER THAN DIAMOND HANDS. RICHER THAN YOUR WIFE’S BOYFRIEND’S UNCLE. YES, THIS IS NONE OTHER THAN DEEPFUCKINGVALUE HIMSELF.",,147460,5766,1611936659.0,wsb pioneer fearless bag holder better diamond hands richer wifes boyfriends uncle yes none deepfuckingvalue,
"WSB, WHAT IS YOUR STRATEGY? 💎✋🚀",,146840,5144,1611921874.0,wsb strategy,
If I can hold at -$10MM then you can hold too. 💎🙌,,145303,6971,1611850284.0,hold mm hold,
"Today, Interactive Brokers CEO admits that without the buying restrictions, $GME would have gone up in to the thousands",,145248,7843,1613612240.0,today interactive brokers ceo admits without buying restrictions gme would gone thousands,
We are all the way up,,144850,1971,1611879053.0,way,
"An Open Letter to Melvin Capital, CNBC, Boomers, and WSB"," **Mods do not delete, this is important to me, please read**

&#x200B;

I was in my early teens during the '08 crisis. I vividly remember the enormous repercussions that the reckless actions by those on Wall Street had in my personal life, and the lives of those close to me. I was fortunate - my parents were prudent and a little paranoid, and they had some food storage saved up. When that crisis hit our family, we were able to keep our little house, but we lived off of pancake mix, and powdered milk, and beans and rice for a year. Ever since then, my parents have kept a food storage, and they keep it updated and fresh.

Those close to me, my friends and extended family, were not nearly as fortunate. My aunt moved in with us and paid what little rent she could to my family while she tried to find any sort of work. Do you know what tomato soup made out of school cafeteria ketchup packets taste like? My friends got to find out. Almost a year after the crisis' low, my dad had stabilized our income stream and to help out others, he was hiring my friends' dads for odd house work. One of them built a new closet in our guest room. Another one did some landscaping in our backyard. I will forever be so proud of my parents, because in a time of need, even when I have no doubt money was still tight, they had the mindfulness and compassion to help out those who absolutely needed it.

To Melvin Capital: you stand for everything that I hated during that time. You're a firm who makes money off of exploiting a company and manipulating markets and media to your advantage. Your continued existence is a sharp reminder that the ones in charge of so much hardship during the '08 crisis were not punished. And your blatant disregard for the law, made obvious months ago through your (for the Melvin lawyers out there: alleged) illegal naked short selling and more recently your obscene market manipulation after hours shows that you haven't learned a single thing since '08. And why would you? Your ilk were bailed out and rewarded for terrible and illegal financial decisions that negatively changed the lives of millions. I bought shares a few days ago. I dumped my savings into GME, paid my rent for this month with my credit card, and dumped my rent money into more GME (which for the people here at WSB, I would not recommend). And I'm holding. This is personal for me, and millions of others. You can drop the price of GME after hours $120, I'm not going anywhere. You can pay for thousands of reddit bots, I'm holding. You can get every mainstream media outlet to demonize us, I don't care. I'm making this as painful as I can for you.

To CNBC: you must realize your short term gains through promoting institutions' agenda is just that - short term. Your staple audience will soon become too old to care, and the millions of us, not just at WSB but every person affected by the '08 crash that's now paying attention to GME, are going to remember how you stuck up for the firms that ruined so many of us, and tried to tear down the little guys. I know for sure I'll remember this. In response, here is a [list of CNBC sponsors and partners](https://www.cnbcevents.com/sponsors/). They include, but are not limited to, **IBM**, **Cisco**, **TMobile**, **JPMorgan**, **Oracle**, and **ZipRecruiter**. Their parent company is [NBCUniversal](https://en.wikipedia.org/wiki/NBCUniversal), owned by **Comcast** and **GE**.

To the boomers, and/or people close to that age, just now paying attention to these ""millennial blog posts"": you realize that, even if you weren't adversely effected by the '08 crash, your children and perhaps grandchildren most likely were? *We're not enemies, we're on the same side*. Stop listening to the media that's making us out to be market destroyers, and start rooting for us, because we have a once in a lifetime opportunity to punish the sort of people who caused so much pain and stress a decade ago, and we're taking that opportunity. Your children, your grandchildren, might have suffered as I described because of the institutions that we're fighting against. You really want to choose them, over your own family and friends? We're not asking you to risk your 401k or retirement fund on a single GME bet. We're just asking you to be understanding, supportive, and to not support the people that caused so much suffering a decade ago.

To WSB: you all are amazing. I imagine that I'm not the only one that this is personal for. I've read myself so many posts on what you guys went through during the '08 crash. Whether you're here for the gains, to stick it to the man as I am, or just to be part of a potentially market changing movement - thank you. Each and every one of you are the reason that we have this chance. I've never felt this optimistic about the future before. This is life changing amounts of money for so many of you, and to be part of a rare instance of a wealth distribution from the rich to the poor is just incredible. I love you all.

&#x200B;

&#x200B;

Note: I can't seem to get a hold of mods and they keep fucking removing the post. I have no idea how to get this to stick and its important to me that the people I'm addressing read it.",144045,7614,1611810374.0,open letter melvin capital cnbc boomers wsb,mods delete important please read xb early teens crisis vividly remember enormous repercussions reckless actions wall street personal life lives close fortunate parents prudent little paranoid food storage saved crisis hit family able keep little house lived pancake mix powdered milk beans rice year ever since parents kept food storage keep updated fresh close friends extended family nearly fortunate aunt moved us paid little rent could family tried find sort work know tomato soup made school cafeteria ketchup packets taste like friends got find almost year crisis low dad stabilized income stream help others hiring friends dads odd house work one built new closet guest room another one landscaping backyard forever proud parents time need even doubt money still tight mindfulness compassion help absolutely needed melvin capital stand everything hated time youre firm makes money exploiting company manipulating markets media advantage continued existence sharp reminder ones charge much hardship crisis punished blatant disregard law made obvious months ago melvin lawyers alleged illegal naked short selling recently obscene market manipulation hours shows havent learned single thing since would ilk bailed rewarded terrible illegal financial decisions negatively changed lives millions bought shares days ago dumped savings gme paid rent month credit card dumped rent money gme people wsb would recommend im holding personal millions others drop price gme hours im going anywhere pay thousands reddit bots im holding get every mainstream media outlet demonize us dont care im making painful cnbc must realize short term gains promoting institutions agenda short term staple audience soon become old care millions us wsb every person affected crash thats paying attention gme going remember stuck firms ruined many us tried tear little guys know sure ill remember response list cnbc sponsors partnershttpswwwcnbceventscomsponsors include limited ibm cisco tmobile jpmorgan oracle ziprecruiter parent company nbcuniversalhttpsenwikipediaorgwikinbcuniversal owned comcast ge boomers andor people close age paying attention millennial blog posts realize even werent adversely effected crash children perhaps grandchildren likely enemies side stop listening media thats making us market destroyers start rooting us lifetime opportunity punish sort people caused much pain stress decade ago taking opportunity children grandchildren might suffered described institutions fighting really want choose family friends asking risk k retirement fund single gme bet asking understanding supportive support people caused much suffering decade ago wsb amazing imagine im one personal ive read many posts guys went crash whether youre gains stick man part potentially market changing movement thank every one reason chance ive never felt optimistic future life changing amounts money many part rare instance wealth distribution rich poor incredible love xb xb note cant seem get hold mods keep fucking removing post idea get stick important people im addressing read
GameStop gear going to the new home at the Children’s hospital of Atlanta Monday. POWER TO THE PLAYERS !,,142502,2376,1616934880.0,gamestop gear going new home childrens hospital atlanta monday power players,
PREACH,,141777,2358,1611772166.0,preach,
"I don't need Fox Business to hold me accountable, but I'll take it!",,140597,2447,1614286746.0,dont need fox business hold accountable ill take,
GME YOLO update — Jan 26 2021,,140106,9326,1611695283.0,gme yolo update jan,
Like this post if you are holding!!💎 The real squeeze is yet to happen🚀,"Buy more during dips if you can, but at least hold.

We just have to hold until they fold. Today's actions by several brokers just show how desperate the hedge funds are getting.

Hold with your immovable diamond hands for all that you hold dear and we will be breaking Wall Street **TOGETHER** while making gargantuan tendies in the end!

**WE LIKE THE STOCK.**

Comment with brokers that aren't corruptible and that we can move to fast!

**YOU CAN STILL BUY ON**  
**Fidelity** (10k instant deposit, accounts can be opened quickly)  
**Others:** Vanguard, Revolut, TastyWorks, Charles Schwab, TD Ameritrade, Webull, Degiro, Wells Fargo, M1, Public, etc.

*Edit*: It seems like TD Ameritrade, Webull, M1 Finance, and Public have removed their restrictions. Brokers are folding to the political support we are receiving.

[**http://isthesqueezesquoze.com/**](http://isthesqueezesquoze.com/)",139424,6804,1611851430.0,like post holding real squeeze yet happen,buy dips least hold hold fold todays actions several brokers show desperate hedge funds getting hold immovable diamond hands hold dear breaking wall street together making gargantuan tendies end like stock comment brokers arent corruptible move fast still buy fidelity k instant deposit accounts opened quickly others vanguard revolut tastyworks charles schwab td ameritrade webull degiro wells fargo public etc edit seems like td ameritrade webull finance public removed restrictions brokers folding political support receiving httpisthesqueezesquozecomhttpisthesqueezesquozecom
First of many lawsuits I hope 🤞🏻 out of this bullshit!!!! #DownWithTheHOOD,,134681,5083,1611855593.0,first many lawsuits hope bullshit downwiththehood,
Billboard! Went full retard!🚀🚀 North of Dallas along super busy I-35,,133448,2312,1612312251.0,billboard went full retard north dallas along super busy,
"Billboard in Oklahoma City, OK! If someone can rent out a billboard for GME you can hold your shares!!! 💎 🖐!!!! (Left watermark for credit)",,132793,3224,1611997395.0,billboard oklahoma city ok someone rent billboard gme hold shares left watermark credit,
Charles Payne gets it!,,131036,996,1611850059.0,charles payne gets,
GME YOLO update — Mar 23 2021,,130337,8071,1616535031.0,gme yolo update mar,
"u/DeepFuckingValue is being asked to testify in the upcoming GameStop hearing. ""Diamond hands and tendies gonna enter the Congressional Record""",,129970,5633,1612395828.0,udeepfuckingvalue asked testify upcoming gamestop hearing diamond hands tendies gon na enter congressional record,
Honor to Diamond Hands.,,129617,2516,1611948006.0,honor diamond hands,
"Cool, but why would they bother telling us?",,129009,8614,1612046608.0,cool would bother telling us,
"Listen, it’s easy",,128367,3256,1612577891.0,listen easy,
CNN BACK. OFF. This is a LIE. Literally a 5 second scroll of our board would inform this to be untrue. EDUCATE yourselves!!!!!,,127664,5938,1612195071.0,cnn back lie literally second scroll board would inform untrue educate,
Welcome to the Endgame.,,126826,5411,1612017491.0,welcome endgame,
Do you think he realized it YES OR NO,,126534,3351,1613742948.0,think realized yes,
You know something is about to go down when most members of Congress are United over Wall Street trying to fuck us.,,124013,2699,1611865257.0,know something go members congress united wall street trying fuck us,
"$265,000 raised so far for Dian Fossey Gorilla Fund ❤️#GMEToTheMoon #ApesStrongTogether 🍌🦍🚀🌕",,123534,2762,1615828417.0,raised far dian fossey gorilla fund gmetothemoon apesstrongtogether,
"DFV’s smile, he’s watching all us apes support him.",,122629,2780,1613685014.0,dfvs smile hes watching us apes support,
Oops,,121638,1042,1611846400.0,oops,
Where do we go from here and who is going to step up to help us?,"We have grown to the kind of size we only dreamed of in the time it takes to get a bad nights sleep. We've got so many comments and submissions that we can't possibly even read them all, let alone act on them as moderators. We wrote software to do most of the moderation for us but that software isn't allowed to read the Reddit new feed fast enough and submit responses, and the admins haven't given us special access despite asking for it.

We're suffering from success and our Discord was the first casualty. You know as well as I do that if you gather 250k people in one spot someone is going to say something that makes you look bad. That room was golden and the people that run it are awesome. We blocked all bad words with a bot, which should be enough, but apparently if someone can say a bad word with weird unicode icelandic characters and someone can screenshot it you don't get to hang out with your friends anymore. Discord did us dirty and **I am not impressed with them destroying our community** instead of stepping in with the wrench we may have needed to fix things, especially after we got over 1,000 server boosts. That is pretty unethical.

To add to this, people are co-opting our name on twitter. I won't mention their accounts, but lots of handles with ""wsb"" and ""wallstreetbets"" in them are pretending to speak for us. They're saying things that we don't agree with, driving traffic to derivative communities and shitty pixelated merch stores, and generally making it harder for us to define who we are. There's also too much political bullshit in a community that was never *ever* political. The only way I want to occupy Wall St is in a suit myself or rent-free in the mind of a blown up short.

~~That is why I'm throwing my support behind the Twitter handle in general. We need a way to PUBLICLY reach out to the staff of the infrastructure that is failing us so the world can see that we aren't doing anything wrong here if they don't respond. We need to be able to respond directly to a reporter that is lying to the world about our clubhouse. We can't be expected to meet any expectations when we aren't given the tools we need.~~

~~That's not to say I approve of every message or will even be in the loop for all of them, but it's clear to me we can't do nothing and we need a megaphone.~~

~~We'll do our best not to pretend to speak for you, but to try to speak with the volume our name now seems to command to get shit done for us.~~

EDIT: As of recent developments the aforementioned twitter handle is obviously not legit anymore. Phew.",120929,27132,1611794162.0,go going step help us,grown kind size dreamed time takes get bad nights sleep weve got many comments submissions cant possibly even read let alone act moderators wrote software moderation us software isnt allowed read reddit new feed fast enough submit responses admins havent given us special access despite asking suffering success discord first casualty know well gather k people one spot someone going say something makes look bad room golden people run awesome blocked bad words bot enough apparently someone say bad word weird unicode icelandic characters someone screenshot dont get hang friends anymore discord us dirty impressed destroying community instead stepping wrench may needed fix things especially got server boosts pretty unethical add people coopting name twitter wont mention accounts lots handles wsb wallstreetbets pretending speak us theyre saying things dont agree driving traffic derivative communities shitty pixelated merch stores generally making harder us define theres also much political bullshit community never ever political way want occupy wall st suit rentfree mind blown short im throwing support behind twitter handle general need way publicly reach staff infrastructure failing us world see arent anything wrong dont respond need able respond directly reporter lying world clubhouse cant expected meet expectations arent given tools need thats say approve every message even loop clear cant nothing need megaphone well best pretend speak try speak volume name seems command get shit done us edit recent developments aforementioned twitter handle obviously legit anymore phew
I'm a brown woman in WSB! What the heck is this article talking about?! 😂,,120686,12396,1615122940.0,im brown woman wsb heck article talking,
DFV,,120623,1102,1611926978.0,dfv,
To the person that's the laughing stonk of their family.,,117431,1332,1612720900.0,person thats laughing stonk family,
Pirates of the Wall-Streetibbean,,117152,1339,1612557995.0,pirates wallstreetibbean,
Just bought $1MM worth of $GME. My profits from years of trading. Let’s stick it to the HFs! 🦍 strong together. 💎 🙌,,117119,5046,1612196248.0,bought mm worth gme profits years trading lets stick hfs strong together,
💎🙌 Here is our DeepFuckingValue in WSB style - art by crossdogz 🚀🚀,,115601,2394,1612103767.0,deepfuckingvalue wsb style art crossdogz,
"Huge shoutout to Kevin O'Leary: ""Definition of the market is speculation. If you are short you know run a new risk that these effective social media vigilantes are going to come after you and squeeze you and its good because it will make a lot of hedge funds think for a second time before shorting.""",,115320,3273,1611967076.0,huge shoutout kevin oleary definition market speculation short know run new risk effective social media vigilantes going come squeeze good make lot hedge funds think second time shorting,
Adopted a Gorilla.,,114488,1903,1615598583.0,adopted gorilla,
"Good Morning to Everyone Except Robinhood, courtesy of @KasparCMS on Twitter",,114082,1246,1612030056.0,good morning everyone except robinhood courtesy kasparcms twitter,
"Don’t listen to them, this is them trying to take focus away from GME",,112694,5607,1612175647.0,dont listen trying take focus away gme,
RASHIDA IS WITH US,,112534,3778,1611846482.0,rashida us,
"THIS GUY IS FLYING A BANNER SAYING ""SUCK MY NUTS ROBINHOOD""",,112295,1820,1612030096.0,guy flying banner saying suck nuts robinhood,
The Hero we need right now : FUCK ROBINHOOD!,,111967,3427,1611841020.0,hero need right fuck robinhood,
